{
  "task_id": "tb-0001",
  "partition": "train",
  "source_mode": "trace_derived",
  "difficulty": "easy",
  "failure_dimension": "tone_style_drift",
  "input": {
    "prospect": {
      "company_name": "Orrin Labs",
      "domain": "orrin-labs.example",
      "contact_role": "CTO"
    },
    "hiring_signal_brief": {
      "company_name": "Orrin Labs Inc.",
      "crunchbase_ref": "https://www.crunchbase.com/organization/orrin-labs-inc",
      "segment_recommendation": "recently_funded_series_ab",
      "segment_confidence": "high",
      "funding_signal": {
        "name": "recent_funding",
        "value": "Series B funding closed 2026-02-12 for $14,000,000",
        "confidence": "high",
        "evidence": [
          "Seeded prospect profile from attached Tenacious sales materials.",
          "Funding event is represented in the provided sample hiring brief."
        ],
        "source_refs": [
          {
            "title": "Crunchbase funding round",
            "url": "https://www.crunchbase.com/funding_round/orrin-labs-series-b",
            "note": "Seeded Tenacious sample brief.",
            "accessed_at": "2026-04-25T07:09:25.271097+00:00"
          }
        ],
        "freshness_days": null
      },
      "job_post_signal": {
        "name": "job_post_velocity",
        "value": "11 open roles today vs 4 sixty days ago (doubled).",
        "confidence": "high",
        "evidence": [
          "Seeded prospect profile from attached Tenacious sales materials.",
          "Job-post velocity is represented in the provided sample hiring brief."
        ],
        "source_refs": [
          {
            "title": "BuiltIn jobs",
            "url": "https://builtin.com/company/orrin-labs/jobs",
            "note": "Seeded Tenacious sample brief.",
            "accessed_at": "2026-04-25T07:09:25.271102+00:00"
          }
        ],
        "freshness_days": null
      },
      "layoff_signal": {
        "name": "layoffs",
        "value": "no layoffs.csv match found for Orrin Labs Inc.",
        "confidence": "medium",
        "evidence": [
          "Searched the configured layoffs.csv snapshot by normalized company name and found no exact match."
        ],
        "source_refs": [
          {
            "title": "layoffs.csv snapshot",
            "url": "file:///Users/gersumasfaw/Downloads/layoffs.csv",
            "note": "Configured layoffs dataset used for layoff-signal enrichment.",
            "accessed_at": "2026-04-25T07:09:25.227675+00:00"
          }
        ],
        "freshness_days": null
      },
      "leadership_change_signal": {
        "name": "leadership_change",
        "value": "No public leadership change detected in the seeded prospect profile.",
        "confidence": "low",
        "evidence": [
          "Seeded prospect profile from attached Tenacious sales materials.",
          "The sample hiring brief records no leadership change event."
        ],
        "source_refs": [
          {
            "title": "Company team page",
            "url": "https://orrin-labs.example/team",
            "note": "Seeded Tenacious sample brief.",
            "accessed_at": "2026-04-25T07:09:25.271102+00:00"
          }
        ],
        "freshness_days": null
      },
      "ai_maturity_score": 2,
      "bench_match_summary": "Bench match from attached materials: python: 7 available; data: 9 available.",
      "ai_maturity_reasoning": [
        "ai_adjacent_open_roles: Two Data Platform Engineer roles and one ML Engineer role open on BuiltIn. 3 of 11 total engineering openings are AI-adjacent (27%).",
        "named_ai_ml_leadership: No public Head of AI, VP Data, or Chief Scientist on the team page. CTO holds a combined infrastructure-and-data remit.",
        "executive_commentary: CEO blog post Feb 2026 mentions 'AI-powered insights' as a 2026 priority. No keynote or podcast appearances on AI strategy in the last 12 months.",
        "modern_data_ml_stack: BuiltWith reports dbt and Snowflake in use. No Databricks, no Weights and Biases, no vLLM. Stack is modern-data but not ML-platform-modern.",
        "github_org_activity: Public GitHub org has 4 repos, all non-AI (developer tooling). Absence of AI repos is not proof of absence \u2014 AI work may be in private repos."
      ],
      "source_refs": [
        {
          "title": "Crunchbase funding round",
          "url": "https://www.crunchbase.com/funding_round/orrin-labs-series-b",
          "note": "Seeded Tenacious sample brief.",
          "accessed_at": "2026-04-25T07:09:25.271097+00:00"
        },
        {
          "title": "BuiltIn jobs",
          "url": "https://builtin.com/company/orrin-labs/jobs",
          "note": "Seeded Tenacious sample brief.",
          "accessed_at": "2026-04-25T07:09:25.271102+00:00"
        },
        {
          "title": "Company team page",
          "url": "https://orrin-labs.example/team",
          "note": "Seeded Tenacious sample brief.",
          "accessed_at": "2026-04-25T07:09:25.271102+00:00"
        },
        {
          "title": "layoffs.csv snapshot",
          "url": "file:///Users/gersumasfaw/Downloads/layoffs.csv",
          "note": "Configured layoffs dataset used for layoff-signal enrichment.",
          "accessed_at": "2026-04-25T07:09:25.227675+00:00"
        }
      ],
      "generated_at": "2026-04-25T07:09:25.271464+00:00",
      "prospect_name": "Orrin Labs",
      "prospect_domain": "orrin-labs.example"
    },
    "competitor_gap_brief": null,
    "bench_summary_excerpt": {
      "stack": "python",
      "available_engineers": 7,
      "requested_engineers": 6,
      "time_to_deploy_days": 7,
      "source": "data/tenacious_sales_data/seed/bench_summary.json"
    },
    "prior_thread": [
      "CTO: Scenario 1 for Orrin Labs uses marker m1x0.",
      "Tenacious SDR: Apply source marker source0 and outcome marker outcome0."
    ],
    "target_channel": "email"
  },
  "candidate_output": "Question on Orrin Labs's engineering plans: Tenacious has engineers ready to deploy if the gap is real. Worth a discovery call next week?",
  "ground_truth": {
    "required_claims": [
      "engineers ready to deploy",
      "question"
    ],
    "forbidden_claims": [
      "A-player",
      "bench",
      "offshore",
      "just checking in"
    ],
    "allowed_evidence_ids": [
      "sig-tone_style_drift",
      "bench_summary_v2",
      "trace_log_week10"
    ],
    "expected_action": "ask for a discovery call"
  },
  "rubric": {
    "deterministic_checks": [
      "required_claims_present",
      "forbidden_claims_absent",
      "expected_action_present",
      "dimension_guardrail"
    ],
    "judge_dimensions": [
      "input_coherence",
      "ground_truth_verifiability",
      "rubric_clarity"
    ]
  },
  "metadata": {
    "source_refs": [
      "artifacts/traces/agent_trace_log.jsonl",
      "probes/probe_library.md",
      "probes/failure_taxonomy.md"
    ],
    "synthesis_model": "local_programmatic_router",
    "judge_model": "deterministic_evaluator_v0.1",
    "created_at": "2026-04-28T00:00:00Z",
    "contamination_hash": "8052c16cce136eb3d60b0e41c2760a6c4ad587418ae7d93d8a1388ae665d64e1",
    "near_duplicate_filtered": false
  }
}
